text	readability
                                                          Stadt X, 13.3.2012 Lieber Michael, Die Silvesternacht hat mir leider kein Spaß gemacht, weil ich krank war. Was für ein Pech! Ich bin ganz nach dem Neujahr ins Bett gegangen. Deswegen ist mein Wunsch für das neue Jahr klar: mehr Gesundheit! Und natürlich viel Glück mit der Arbeit. Dein Brief hat aber mich so sehr gefreut! Es ist super, dass du schon fast fertig mit deiner Ausbildung bist. Lust, dich zu treffen? Natürlich habe ich Lust! Zur Zeit habe ich leider nicht viel Zeit für Freunde gehabt, wegen der Arbeit. Aber glücklicherweise habe ich jetzt mehr Zeit, ein bisschen mich zu unterhalten. Außerdem, Neustadt ist nicht weitweg von hier. Geht es dir, zum Beispiel nächsten Monat uns zu treffen? Es wäre echt toll. Bei meiner Arbeit geht es gar nicht gut. Ich finde sie doch langweilig, und ich will eigentlich sie andern, aber mal schauen. Schreib mir bald, und sag mir, ob du endlich mich nachsten Monat treffen kannst. Liebe Grüße Friedrich	2
                           13.03.12 Liebe Julia, Ich möchte eine hilfe von dich frgen. Ich habe eine Fahrkarte für einen Wochenendausflug gekauft. aber leider ich kann. nicht fahren, weil ich andere termin mit meinen Artz habe. So möchtest du mein Fahrkarte haben. Du kannst mit dem Zug fahren. weil ich Zug fahrkarte habe. Ich denke du hast frei am Wockenende. Wenn möchtest du haben, du kannst mich anrufen. Ich warte auf deine antwort. Vielen Dank. Sr. Maria	3
Maria Meier Müllergasse 1 12345 Stadt X Au-pair Agentur Schultz & Partner Regenstr. 101 90451 Nürnberg                                         Stadt X, den 08.09.11 Beschwerde Sehr geehrte Damen und Herren, nachdem ich hier in Sweden Ihre Anziege im internet gelesen hatte, meldete ich sofort ein vierteljahr bei einer Gastfamilie in Deutschland. Doch leider wurde ich Tag zu Tag großer enttauschung. Das Hauptprobleme war, meine Gastfamilie stamme sich von Bayern, und sie sprechen nur bayerisch. Ich könnte gar nicht verstanden. und die Kinder lasst mich nicht sich kümmern. Die Eltern haben meinen vertrag gekundigt. Ich habe doch nicht solche Situation erwartet. Die Schlimmste war, meiner Betreunng durch die Agentur entspricht in keiner weise vertragsbedingungen. Ich bin sehr ärgerlich und fordere einen Lösungsvorschlag von ihnen, ansonsten schalte ich meinen Anwalt ein. Mit freundlichen Grüßen Maria Meier	1
Hallo Julia meine Frau und Ich wollten nach Köln im ZuG in der nacht vahren wann 2.1.2011 bis 04.01.2011 Ich nehme besoche meine Tochter. Ich kanne nicht Fahren. Fragen Sie Ihre Julia. meine wollten ist gut ich Besoche Kerche und centrem. meine Hotel ist gut viel Gruße Danke	3
Maria Winkelmann Müllergasse 12 1234 Stadt X Au-pair-Agentur Schulz & Partner Regenstrasse. 101 90451 Nürnberg                                 Stadt Y, den 24. Sep 2011 Beshwerde Sehr geehrte Damen und Herren, Hiermit möchte ich über die Betreuung beschweren. Nachdem ich mit grossem Interesse Ihre Anzeige gelessen hatte, habe ich bei ihnen sofort angemeldet und zwar ich glucklich am Anfang war, aber alles verändern sie sich nur nach eine woche. Da im Ihren Anzeige, Beratung, Betreuung und super-guten Service entschprochen würde aber alle diese Entsprochungen war nicht von ort eingehalten würden.  Die Betreuung durch die Agentur hat mich verärgert weil es schlechter weiter geht letzte mal war ich dort bei Ihrer Firma und die Cheffin hat mir erklärt dass ich kann nicht den Vertrag unterbrechen.  Deshalb fordere ich mich 50 % des gezalten Betrages zurück. Mit freundlichen Grüssen  Maria Winkelmann	1
Liebe Ingo. Hilfst bitte, Ich suche neue Wohnung. Ich brauche, so wie dein Größe Wohnung, kannst du dein Vermiter Fragen?. Er hatt vielleich ein wohnung Frei in Gebäude. Danke, liebe Ingo. Du. Freundin, Katharina	4
Maria Bahnhofsstraße 123 12345 Stadt X.  Stadt Y Rundhaus Kleines Haus                                                                                        Stadt X, den 9. März 2012 Sehr geehert Damen und Herren, Ich möchte eine neue wohnung in Stadt Y  zentrum. Meine Eltren und ich wohnen zur zeit zwei monate in Stadt X Ich bin krankenpfleger von Beruf. Ich möchte drei zimmer wohnung Ich wollte Balkon und Garage. wie viele kostet die wohnung? gibt es eine Banhof nächten in der wohnung? wie hoch sind die umlagen und Nebenkostet? Mit freundlichen Grüße Maria Meier	3
Lieber Ingo Wie geht es dir? Ich habe eine Arbeite in Neuburg gefunden und brauche eine Wohnung da. Könntest du mir helfen? Ich möchte eine Wohnung c.a. 65 m². Mit Freundlich Grüßen Maria	4
WINKELMANN EVA ZENTRALPLATZ 12 54321 STADT X-STADTTEIL INTERNATIONALE AU-PAIR VERMITTLUNG BAHNHOFSTR. 101 65185 WIESBADEN                                  STADT X, DEN 19.04.2011 -INFORMATIONEN ÜBER INTERNATIONALER AU-PAIRS NACH DEUTSCHLAND Sehr geehrte Damen und Herren, mit großem Interesse habe ich Ihre Homepage gelesen; däfur interessiere ich mich sehr. Ich bin eine Italienische Frau die nach Deutschland gekommen ist, um Deutsch zu lernen. Ich bin auf Ihre Anzeige aufmerksam geworden, weil ich ein Au-pair Mädchen sein wollte. Aus diesem Grund habe ich ein Paar Fragen: ist eine perfekte Deutsche Kenntnisse notwendig oder nicht? Soll ich eine Prüfung über meine Deutsche Kenntnisse beschäftigt? Und welche Formalitäten darf ich machen vor dem Abfahrt? Gibt es Gruppen-aktivitäten? Mit diese Erfahrung würde ich gerne meine Sprache zu verbessern sowie neue Leute kennenzulernen. Ich freue mich auf ein Jahr als Au-pair. Ich danke Ihnen im Voraus für Ihre Aufmerksamkeit. Über eine baldige Antwort freue ich mich. Mit freundlichen Grüßen Eva Winkelmann	1
"Ich möchte gerne über das Thema „Traditionen aus meines Heimatlandes  im Ausland oder die Kultur des Landes, nehmen, wo ich wohne."" An erster Stelle würde ich sagen, dass es von der Heimat jeder Person. und Ausland abhängt. Ich erkläre das, weil ich auf die Kanarische Inseln Komme, und in diesem Fall ändert das Wetter sich alles. Wir haben Keine richtige Weihnachten, weil wir eine regelmäßige Temperatur von 20 Grad das ganze Jahr haben, also bin ich am Strand im Winter. Nach dieser Erklärung nehme ich an, dass, wenn man im Ausland ist, sollte die Traditionen vom Ausland gelernt werden. man muss nicht unbedingt alle Traditionen lernen aber es ist eine der besten Weisen um die Integration im Land zu schaffen. Andererseits muss ich sagen, dass man die Taditionen von unserem Land nicht vergessen werden müssen, da sie die Stamm unserer Erziehung sind. Das wäre, wie wir unsere Eltern oder Großeltern vergessen würden Bis jetzt habe ich zwei entgegensetze Meinungen gegeben, Warum das? Weil meine Absicht nicht extrem ist, also denke ich, dass die richtige Lösung eine Mischung zwischen beide Erklärungen ist. Man muss die Kultur und Traditionen vom Ausland kennen und lernen aber niemals unsere Traditionen vergessen. Am Ende möchte ich gerne auch sagen, dass, wenn man in Deutschland ist, ist einfacher für jemand, die von Europa kommt als ein andere, die von Afrika zum Beispiel kommt, aber die neue Traditionen müssen gelernt werden und die alte nicht vergessen werden."	0
Müller Michael Bahnhofsstraße 12 1234 Stadt X                                    2011.07.08 Au-pair Agentur Schultz & Partner Regenstr. 101 90451 Nürnberg Beswerden über die Betreung. Sehr geehrte Damen und Herren, Als ich Ihre Anzeige über meine Gastfamilie angesehen, habe mich Sofort gefreuen die familie zu Sehen. Aber nach meine Ankunft ist mir Schön Klar dass die familie nicht So nett, die waren nicht frohlich und es gab immer Streiht. im hause. Ich habe die Kinder geschenke geKauf um nett zu Sein und ich habe immen und immer vesuchen freuntlich mit dem Kinder anZuschließen, es war unmöglich. alles war Enttauschung im haus war immer laut Ohne ende, es war nicht was ich Erweitet habe Aus diese Grund find ich man muss erste Überlegen bevor reist und muss ich Sagen alle meine Erwartungen: war nicht als ich vorgestelte habe, ich möchte Antworte Zuruck. mit freundlichen Grüßen Michael Müller	1
Maria Meier 12-321 Stadt X Zentralplatz 12                                                                        Stadt X, 07.06.2010                                                                                        Computer Spezialist                                                                                        Odenwaldstraße 5                                                                                        55119 Bonn Bewerbung Sehr geherte Damen und Herren Ich habe Ihre Anzeige in Gazda Wyborcza  gelesen und möchte mich als Praktikantin bewerben. Ich habe eine Fachschule beendet. Meine IT-Kenntnise sind sehr gut.  Ich spreche gut Englisch und lerne jetzt Deutsch. Seit 5 Jahren arbeite ich als Kaufmann  in einem großen Buchhandlung und habe schon eine Erfahrung im Handel. Ich habe auch Führerschein und ein eigene Auto. Die Arbeit mit den Leuten gefällt mir sehr und habe immer guten Kontakt mit Kunden und Mitarbeiter. Die Leute, die mich kennen, sagen, dass ich verantwortungsvoll und offen bin  Ich möchte gern in einer großen Firma wie Computer-Spezialist arbeiten, meine IT-Kenntnisse Benuzen und Erfahrungen sammeln. Ich glaube, dass ich eine Möglichkeit mich persönlich vorstellen von Ihnen bekommt Mit freundlichen Grüße M M 	1
                               Stadt X                                den 22.3.2012 Liebe Dana, ich freu mich, dass du deine Prüfung bestanden hast und in Istanbul gefahren bist.  Ich möchte mit dir dort sein, aber ich kann nicht jezt, weil ich zu viel arbeiten. Mein Urlaub wird keine bald, nur den Sommer. Ich kenne nicht deine verwandten, aber sende Ihm viele Grüße... Du sagt mir, dass du für mich etwas kaufen kannst. Ich weiß nicht.  Ich warte auf dich. Wenn du zu Hause kommen, treffen wir uns. Schade, meine Verwandten leben mit mir, aber ich kann jeden Tag Ihre beschen. Viele Grüße Katharina	2
"Dieser Bericht richtet sich an allen ausländische Leuten, die sich um eine Stelle bei ""MfG„ bewerben wollen und er gibt Auskünfte über die Stadt und die Preise von Häusern. Prinzipiell ist Stadt X eine sehr schöne Stadt, wo besonders Kinder ihre Freude finden können, weil Stadt X reich an Spielplätze und Wiesen sind. Auch Erwachsene können sich jedoch gut unterhalten, denn Vereine sind hier überall Verbraitet, und besonders Einzelpersonen können hier viele Kontakte knüpfen und, wenn jemand Glück hat, vielleicht auch die Leibe finden. Von wichtigen Bedeutung ist, dass in dieser Stadt alle immer bereit sind, dem anderen zu helfen, wenn er in Not ist. Was Wohnungsmarkt betrefft, sind die Preise hier sehr teuer wenn man nicht genau weißt, wo man suchen sollte. Aus diesem Grund gibt es in Stadt X ein zuständiger Amt,  wo man fragen und herausfinden kann, was am bestens für jeder passt. Dieser Amt heißt ""Ein Haus, ein Leben„ und befindet sich in Winkelsweg 19. Es lohnt sich aber immer mehr, ein Haus zu kaufen, statt eines zu mieten. Es"	0
                                            Stadt X, 13.03.2012 Lieber Michael, vielen Dank für deine Wünsche. Ich wünsche dir auch alles Gute zum neuen Jahr. In der Silvesternacht sind meinen Mann und ich auf die Bahnhofstraße gegangen. Wir haben Musik gehört, getanzt und Wir uns das Feuerwerk in Stadt X am Fluss angesehen haben. Wir haben unsere Freude besucht. Ich habe eine gute Gescheck von meinem Mann bekommen. Wir haben im Indian-Restaurant gegessen. Wir hätten eine schöne Silvesternacht. Alles gehts gut bei meiner Arbeit. Ich arbeite als Software Engineer. Jetze haben wir eine neue Technology. Ich lerne die. Jeden Tag bekomme ich viel arbeit. Ich brauche viel zeit, weil der Job neu für mich ist. Obwohl ich viel arbeit habe, interresiere ich mich viel lernen. Mein Team ist nett und freundlich. Ich habe Zeit im Frühjahr. Wir können uns treffen. Wann könnten wir treffen? Ich würde auch mit dir reden. Ich freue mich auf einen Besuch. Viel Glück für ihre Ausbildung. Liebe Grüße Julia	2
                            28/02/2012 Liebe Silke, Ich habe gelessen deine brief Viel Dancke Für das brief. Ich war gut meine Familier auch sehr gut. Ich Früch mich Für anne geht in der Kindergarten Und Fruch mich Fur max geht gut in der Schuler Ich nichst Woche Ich habe mein Geburtstag Ich einladen wir Für 26/03/2012 Ich bisüche Wir nechst Woche Liebe Grüß STEFAN	2
                                      Stadt X 12-3-2012 Liebe Julia,         wie geht´s dir? Ich möchte für zwei tage nach Stadt Y fahren. Ich habe eine Katz. Ich kann die nicht mitnehmen. Deshalb möchte ich deine hilft von 17 marz bis 20 marz. Vielen danke  deine  Katharina	3
"Ich hab mit grossem Interesse auf einem Internetforum das Thema ""Ist es sinnvoll auch im Ausland die Traditionen seines Heimatlandes fortzusetzen, oder sollte man sich and der Kultur des Gastlandes orientieren?"" und will meine meinung dazu sagen. Ich denke, dass es wie jeden Thema Vorteile und Nachteile hat. General finde ich, dass man sich an die Traditionen des Land gehalten muss und respekt haben. Man muss sich an die Regeln verhalten. Man sieht es deutlich an folgenden Beispiel: Wenn mann auf China geht und in ein Temple sein voll wo es steht bitte nicht sprechen bleibt man einfach in ruoh. Wir würden auch nicht gerne, dass Zum Beispiel 2 Korean am Sonntag Morgen in unsere Kirche kommen , fange an zu sprechen und Photos zu machen. Ich bin der Meinung, dass es um Astahnd geht. Es gibt aber auch nachteile. Zum Beispiel in Turkey kann mann kein Fleisch am sonntag essen so gehst du in ein Resaurant willst du ein stück fleisch und sie sagen Nein. Aber ich denke, dass bevor, dass jemand in Ausland geht solt er sich Informieren und darüber gedanken mache was er kann und was er nicht kann im Gastland machen Wie ich schon Erklärt habe, ich bin der meinung, dass die jeweilige Person an der Kultur des Gastlander Orientieren muss."	0
Hallo Ich habe die Antworten für der Frage „Ist es sinnvoll, auch im Ausland die Traditionen  ...?“ und ich möchte meine Meinung mitteilen. Ich glaube, dass es gut und richtig ist, wenn man ihren Heimat lebt und kennt die Traditionen von ihren Volk. Wir leben in einem globalen Welt aber die Kulturen von Menschen musst unverletzt und ungemischt sein. Natürlich ist es wichtig den Kultur des Gastlandes kennen lernen aber Identität ist ein wertvolles Schatz. Man kann auch profitieren durch fremde Kulturen, zum Beispiel chinesische Speisen sind beliebt in vielen Land. In Australia ist das ungarische Wurst ein grosses Erfolg. Es ist kein Problem mit fremden Kultur zu leben in Ausland, natürlich es hängt davon ab, wie die Stimmung in dem Gastland ist. Manchmal gibt es Diskrimination aber im westlichen Welt die Leuten haben das Recht ihre Traditionen zu pflegen. Auserdem glaube ich, dass unser Welt ist, besser mit Fried und Solidarität für anderen Traditiönen. Es wirkt in der USA, die ein sehr bunte Bevölkerung hat. Man kann für Jobs amnelden ohne Problemen Natürlich ist es wichtig die Sprache des Gastland zu sprechen. Kommunikation spielt ein grossen Rolle im Leben	0
Unsere Kultur im Ausland Hiermit möchte ich meine eigenen Erfahrungen im Zusammenhang mit dem Üben unserer Kultur, wenn wir im Ausland sind mitteilen. Meiner Meinung nach ist es sehr wichtig, dass wir unsere Kultur auch ins Ausland mitnehmen, damit wir viele interessante Informationen den Ausländern übergeben können. Warum ist es eigentlich wichtig? Weil die Leute, die in den ausländischen Ländern leben, dadurch uns kennenlernen können. Sie können nützliche Traditionen kennenlernen und wenn die Ausländer die Kultur unseres Heimatlandes gut benutzen, können ihr eigenes Leben erleichtern. Wir dürfen ihnen unsere Kultur nicht zu stark anbieten, sonst werden die Ausländer davor vielleicht Angst haben und dann werden die Traditionen nich übergeben zu können. Und das wäre eine grosse Fehler. Anderseits sollen wir für die ausländische Kultur Interesse haben. Also ich es schon erwähnt habe, auch wir können davon wichtige Informationen erhalten. Wenn wir schon im Ausland sind, können wir auch die Sehenswürdigkeiten des fremden Landes besichtigen. Diese Sehenswürdigkeiten sind meistens im Zusammenhang mit der Kultur. Wir können die Ausländer fragen, wo diese Sehenswürdigkeiten zu finden sind, bestimmt werden wir auf diese Frage einen höflichen Antwort bekommen. Die meiste Ausländer freuen sich, wenn Turisten in ihrem Land einen kürzeren oder einen längeren Aufenthalt verbringen. Antwort auf die Frage ist ja, es ist sinnvoll, aber wir können die Kultur des Gastlandes auch nicht vergessen.	0
Liebe Julia, wir geht es dir? Mir geht´s gut. Ich habe eine Fahrkarte für einen Wochenendausflug gekauft, aber ich kann leider nicht fahren, weil ich ein Spielt habe. Also ich wollte nach Spanien fahren. In 2 Wochen am Samstag 19. Mai um 13h10. Ich habe eine Fahrkarte für einen Wochenendausflug gekauft, um nichst.Glücklicherweise bist du da. Deswegen frage ich, ob du meine Fahrkate haben möchtest. Das ein Geschenk für dich Ha, ich hatte fast vergessen, meine Fahrkate läuft nur 3 tags ab. Tschüss!!! Stefan	3
Lieber Jens, ich frohe mich für euch. Es ist wunderschön. Ich gratuliere und wünsche viel Glük, Gesund und alles Gute. Wie heißt dein Baby? Ist es alles gut? Wie fühlt sich deine Frau? Wann ist deine Frau mit Baby nach Hause zurückkommen? Ich möchte ein Geschenk für dein Baby bringen. Wann kann ich zu ihnen kommen? Gruß für deine Frau. Liebe Grüße Maria	4
Eva Meier Zentralplatz 1 12345 Stadt X Aupairsglobal Bahnhof str. 101, 65185 Wiesbaden                                                                                               26.4.2011 Ihre Anzeige im Internet vom 24.4.2011 Sehr geehrte Damen und Herren, ich interessiere mich für Ihre Anzeige als Aupair. Ich möchte noch etwas über Au-pair wissen. ich hieße Eva. Ich komme aus Indien. Jetzt lerne ich Deutsch in der Akademie Klausenhof Ich lerne Deutsch, weil ich in Deutschland studieren und arbeiten möchte. Meine Freundin hat mir gesagt, Wenn ich gute Sprache haben möchte, musse ich 1 Jahr als Aupair arbeiten - Ich weiß es nicht, ob es möglich ist? Ich möchte wissen, ob diese Familie oder Personen genau Hilfbereits sind? Gibt es ein möglichkeiten Deutsche Sprache zu lernen? Wenn ich als Au-pair arbeiten, muss ich immer arbeiten oder konnte ich meine, Zeit freizeitaktivitäten auch benutzen? Ich glauben, dass, ich mit diese arbeit nicht nur meine Sprache verbessen konnte, sondern auch konnte ich Deutsche Kulture und neue Fremde Leute auch kennen lernen? Ich habe noch Fragen, Wass soll ich machen, wenn ich eine Stelle als Au-pair bekommen möchte. Soll ich eine Bewerbung schreiben oder Muss ich in Ihre Firma kommen? Ich wäre dankbar, wenn Sie mir baldige Antwort geben könnten. Mit freundlichen Grüßen Eva Meier	1
Julia Müller Zentralplatz 12 A 2 Stadt X - Peru Au-pair-Agentur Schultz & Partner Regenstr. 101 90451 Nürnberg                                                         Stadt X, 08.09.2011 Beschwerde Au-pair-Agentur Schultz & Partner. Sehr geehrte Damen und Herren, als ich Ihre Anzeige in der Süddeutsche Zeitung gelesen habe, habe ich sofort mit großem Erwartungen bei Ihrem Au-pair-Agentur Schultz & Partner angemeldet. Nach meinen Erlebnissen möchte ich nun meinen großen Enttäuschung Ausdruck verleihe Als ich angekommen bin, wurde in eine zwar  -unreadable- Familie gewöhnen. Ich dachte, dass ich hier mein Deuscht verbesser könnte aber da war nicht. Die Familie haben keine Zeit mit mir zu reden Außerdem musste ich statt zwei Kinder, drei Kinder aufpassen Wie ich Ihre Anzeige gelesen habe, könnte ich Freizeit habe aber das war auch nicht. Ich hatte überhaubt nicht keine Freizeit Ich wollte in eine Deutschschule Teilnehme aber ich habe vollzeit gearbeitet. Ich konnte auch nicht Deutsch lernen Vor einem Monat habe ich mit der Au-pair-Agentur versucht zu reden aber Sie möchten nicht mit mir reden. Sie haben keine losung für meinen Problemen gefunden Aus diesem Grund, bitte ich Sie mindestens 40 % meiner Reisekosten züruck zu erstatten, Andernfalls sehe ich mich gezwungen meinen Rechtsanwalt einzuschalten Mit freundlichen Grüßen Julia Müller	1
Au-pair-Agentur Schultz & partner Regenstr. 101 90451 Nürnberg   Maria Meier Bahnhofsstraße 12 12345 Stadt X                                                                                                        Stadt X, 29.07.11 Beschwerde über Au-Pair-Agentur Sehr Geehrte Damen und Herren, ich möchte mich beschwere über meine Erfahrung als ein Au-pair-Mädchen In das Haus der Gastfamilie hat kein Zimmer für mich Ich habe ein Zimmer geteilt mit der kleinen Töchter. Ich habe gar nicht gut geschlafen. Deshalb ich war immer krank. Dann die Mutter von die Gastfamilie war sehr böse und am meistens sie hat geärgeret mit mich. Es ist nicht meinen Schulz wenn die Töchter verhalten sich schlecht. Ich habe viel gewartet auf Ihnen. Ich finde dass ich meine job Gut gemacht habe aber das Gehalt war sehr wenig. Ich wäre lieber bei ein andere Familie. Deutschland hat mir gefallen, deshalb ich hier bleiben möchte. Ich suche ein Gastfamilie bei den ich meine eigene Zimmer bekommen. Bitte ruf mich an wenn Ihr ein andere Familie gefindet hat. Mit Freundlichen Grüßen Maria Meier	1
                           Stadt X 16.03.2012 Lieber Ingo, wie get´s dir? Ich habe eine Arbeit in Neuburg. Ich suche eine Wohnung in Neuburg. Ich brauche am 05.04.2011 neue Wohnung und 60 qm.größe. Kann du mir helfen? Liebe Grüße Maria	4
                                   Stadt X 04-01.2012   Sehr geehrte Damen und Herren, Mein Name ist Eva Müller, Ich such ein Wohung für seiben zimmer, vier schlafe zimmer und ein Bad zimmer, wohnzimmer und Küche, mit ein Balkon, und die Miete Kosten etwas 600 bis 700 € Viele Grüße Eva	3
In dem 21. Jahrhundert liegt es voll im Trend ins Ausland zu fahren. Warum gibt so viele Leute, die im Ausland leben wolen Die Frage ist sehr zusammengestzt, es lässt sich nicht so einfach beantworten. Es liegt vielleicht daran, dass die Mehrheit der Menschen an etwas Besseres hofft. Die Jugendliche fahren ins Ausland die Fremdsprache zu erwerben oder ausländisches Praktikum zu machen und die Erwachsene um eine gute Stelle zu bekommen. Wen man in Ungarn eine Statistik machen würde, wäre das Ergebniss abschmetternd. Ziemlich viele Leute möchten bei einer Multinationallefirma arbeiten. Leider sehr wenig Leute folgen der traditionellen, ungarischen Berufen. Das multikulturelle Leben ist eine der Schattenseiten der Globalisierung. Die Kulturen verschmelzen immer mehr ineinander. Die Einzigartigkeite eines Ländes wird verloren.  Es ist eigentlich sehr traurig, dass die Brauche und die Kultur relativ wenig Bedeutung haben. Also alles insgesamt, ich akzeptiere die traditionverbundene Leute. Es ist sehr wichtig unsere Gebrauche zu pflegen. Wenn die Leute mehr ihre Tradition wahren würde, könnte die Nationalitätbewusst auf eine höhere Niveu gestellt werden.  Zusammenfassend könte man sagen, dass man sich überlegen solte, was man im Leben für wichtig hält. Meiner Meinung nach jeder entscheidet sich selbst über sein Leben und muss danach streben um die Harmonie und die Balance zu finden.	0
                                      Stadt X, 04.01.2012 Sehr geehrte Damen und Herren, ich suche eine Groß Wohnung. Ich brauche vier Zimmer, weil ich drei Kinder habe. Ich brauche auch eine Garage für meine Auto. Mit Freundlichen Grüßen. Eva Müller	3
Julia Winkelmann Müllergasse 12 12345 Stadt X   Aupairsglobal Bahnhofstr. 101 65185 Wiesbaden                                                                            Stadt X, den 29 März 2011 Betreffzeile: Informationen zu fragen Sehr geehrte Damen und Herren als Schülerin von Beauticu Gymnasium in der Schweiz, wende ich mich an Ihnen, weil ich als Au-pair sehr gerne in Deutschland werden möchte. Zuerst, habe ich einige Fragen über die Sprache: muss ich nur in Deutsch sprechen? Oder Französisch wären auch möglich? Vielleicht beide wären benutzt, mit die Kindern zu sprechen. Kann ich auch für Freizeitaktivitäten hoffen? Oder mit die Kindern arbeiten wäre nur was ich machen sollte? Ausserdem, ich habe viel mit Tiere gearbeitet und deshalb möchte ich wissen, ob einige Aktivitäten mit Kindern und Tiere möglich wurden. Aus den oben genannten Fragen, möchte ich Sie bitten, mir weitere Informationen senden. Eine Au-Pair-Stelle in Deutschland wäre eine wunderschönes Innovation für mich, um meinem Deutsch zu verbessern. Das wäre auch sehr positiv, mit Kindern zu arbeiten, als sie wirklich wichtig für mich sind. Natürlich stehe ich Ihnen jeder Zeit zur verfügung und verbleibe mit freundlichen Grüssen . J. Winkelmann	1
