text	readability
"Ich beschäftige mich mit der Frage „Ist es sinnvoll, auch im Ausland die Traditionen seines Heimatlandes fortzusetzen, oder sollte man sich an der Kultur des Gastlandes orientieren?"" Diese Frage ist sehr aktuell und berührt alle Emmigranten. Von besonderer Bedeutung ist für mich, in Deutschland zu integrieren. Das bedeutet vor allem, man sollte deutsche Sprache lernen, die deutsche Kultur kennenlernen und neuen Freunden finden. Meiner Meinung nach, um besser die Deutschen zu verstehen, sollte man deutsche Geschichte kennenlernen, deutsche Bücher lesen, Müsik hören. und deutsche Filmen sehen. Die bedeutende Philosophen, Schriftsteller, Komponisten und Wissenschaftler sind Deutschen. Die Weltkultur und Wissenschaft kann man nicht ohne Beethoven, Bach, Wagner, Goethe, Marks und Engels, ohne solche Erfindern, wie Guttenberg vorstellen. Die Aufenthalt in Deutschland ist eine sehr gute Gelegenheit, die reiche deutsche Kultur kennenzulernen. Natürlich werde ich nicht auf meine ukrainische Traditionen verzichten. Aber mir ist besonders interessant, auf deutsche Kultur zu orientieren.  Wenn ich zum Beispiel Theodor Storm lesen, verstehe ich besser deutsche Seele und lerne dabei Deutsch. Die Filmen über deutsche Kristenzüge tragen mich in den Mittelalter über und helfen mir beim Lernen. Die Film über Martin Luter hat mir viel von Religionsgeschichte erzählt.  Abschließen möchte ich noch hervorgeben, dass man ohne Kulturkenntnisse nicht in Gastland umgehen kann. Das ist eine Voraussetzung, um in Gastland zu integrieren und sicher sich zu fühlen."	0
                                                 Stadt X 08.03.2012 Lieber Michael, vielen Dank für deinen Brief. Ich würde gern dass diese neus Jahr gemeinsam machen, wenn du hier bist? Können wir villeicht ins Disko gehen, oder zu Hause kleine Party machen, oder in die Altstadt gehen. Wir haben an Silvester mit meine Familie zu Hause gekocht, getanzt und viele Spaß haben. Ich wünche dir auch alles Gute! Ich habe dich nicht erzälen dass ich eine neue Arbeit gefunden habe. vor vieleicht 4 monaten bin ich eine neue Stelle arbeit. ich finde dass bissen schwerig, weil ich viel Stunde arbeiten muss. und meine Kolege bissen blöd. Ich würde gern, ein Woche später, mit dich treffen. Gemeinsam in Theater oder ins Kino gehen. oder zu Hause kochen. Willst du das? Herzliche Grüße Anna Schmidt	2
                                                            Stadt X, 08.03.2012 Lieber Michael, wie geht es Dir? Ich hoffe das alles klar. Ich danke Dier für deinen Brief. Ich bin sehr traurig, weil wir nicht mit euch die Silvesternacht feiern könnten, aber das war schön auch bei uns. wir waren bei meiner Schwigermutter. Ich habe Tunesische Spezialitäten gekocht. Nach dem Essen und dem Trinken, sind wir raus gegangen, weil wir das Feuerwerk ansehen möchten. Wir haben viel gelacht, weil meine Frau viel angst hat. Um ein Uhr, haben wir das Geschenk für meiner Schwigermutter gegeben und sind wir nach Hause gefahren. Du kannst uns besuchen und wir knnen zusammen ins Türkisch Restaurant gehen. Du kannst am Samstag nachmittag kommen, weil ich Frei habe. Über meine Arbeit arbeite ich jetzt in verschiedene Schicht. Das ist gut für mich und auch ich verdine viel Geld. Für das neue Jahr, wunsche ich noch viel Geld zuverdienen und ein Kind. Viele Grüße Friedrich	2
                          Stadt X, 09.03.12. Liebe Dana, ich danke dir für deinen Brief Und schon am Anfang möchte ich dir gratulieren zur deiner bestandene Prüfung. Es freut mich sehr, dass du das endlich geschafft hast. Ich erinerre mich noch daran, wie viel Stress hat das dich gekostet. Ich wüsste nicht, dass du so eine Reise geplannt hast. Es ist eigentlich mein Wünsch, nach Türkei zu fahren. Vielleicht nächste Woche ich komme dich besuchen? Wer weißt? Wenn neien, dann ich wünsche mir einer Kleinigkeit von dir aus Istanbul. Meine Schwester hat eine Tasche von Prada dort gekauft, und nur für 7 €. Ich möchte gern auch so eine haben. Ich schicke dir das Geld. Ich wäre sehr dankbar, wenn du so eine findest. Es ist super, dass du dich dort so ausruhen kannst. Dazu noch mit deiner Famillie. Meine Verwandte leben in Amerika. Vielleicht fahren wir nächste Sommer hin. Sie warten auf mich schon seit paar Jahren. Es wäre toll wenn ich sie endlich besuche. Ich schreibe jetzt zu Ende. Schick mir deine Adresse, dann ich komme nächste Woche, wenn ich Ticket in Internet finde. Liebe Grüße Eva	2
                                     Stadt X, den 22.03.2012 Liebe Dana, Glückwünsch zur bestandenen Prüfung. Ich freue mich sehr. Das ist schön, dass du viele Spaß in Istanbul habt. Ich würde auch dort fliegen. Aber jetzt habe ich keine Zeit, weil ich für in nächster Monat eine Deutschprüfung viele lernen muss. Vielleicht nächstes Jahr mache ich dort einen Urlaub und besuche meine Verwandten. Meine Tante und mein Cousin leben in der Hauptstadt in Istanbul. Kannst du mir eine Landplan von Istanbul mitbringen? Dazu ich nächstes Jahr dort benutzen kann. Nach deiner Rückkehr besuche ich dich natürlich gerne. Viele Grüße Eva	2
                                          16.03.2012 Liebe Ingo, Wie gehts dir? Ich habe eine Arbeit für dir gefunden. Wann bist du in Neue Wohnung? Wie große ist der Wohnung? Ich kaufe bei der Wohnungssuche hilfe. Schreibst mir ein Antwort bitte! Gruße von Julia	4
                                            Stadt X, 04 01 2012 Sehr geehrte Domen und Herren, Ich suchen eine neue Wohnung. Ich bin heiratet. Ich moschte meine wohnung zwei zimmer und ein kuche ein Bod ein Bolkon.  Können sie bitte mir, wie viel kosstet om monot und vie viel Heben koste. Ich möchte Won miete Mit freundliche Grüßen Evo Muller 	3
Hallo Lieber Jens, Herzliche Glückwünsche das Babys! Ist es ein Mätchen oder einen Junge? Wie geht es das Baby? Wie heißt es? Wie geht es die Mutter? Ist beide gesund? Ruf mir an. Viele Grüße Deine Cousine Maria	4
Maria Schmidt Bahnhofsstraße - 12 Stadt X . Srilanka AUPAIRSGLOBAL                         Stadt X. den 14.03.11 Bahnhofstr. 101 65185 Wiesbaden 0611/998876 Sehr geehrte Damen und Herren, ich habe ihre Anzeige in der Zeitschrift gelesen und ich interessiere mich sehr in diese Stelle. Ich habe Srilankische Aufenthalts und Reise Spass.  Ich habe seit 5 Jahren in meinen Heimatland Deutsch gelernt und kann gut sprechen und schreiben. Ich will in Deutschland noch etwas mehr lernen. Können sie auch diese Stelle in Deutschland gibt auch. Ich will in der Freizeit etwas sportlich machen z.B Schwimmen oder Basketball spielen. Können Sie das machen Oder haben Sie andere möglichkeiten. Welche Rechte und Pflichten haben Sie dorthin schreiben Sie bitte alles mir Ich danke mich für Ihnen und ich warte Ihre positive Antworten. Mit freundlichen Grüßen Maria Schmidt	1
Ich schuche eine Wohnung Ich schuche 3-4 zimm und eine Balkon und eine Garage. und in Dreter Stück. Ich kann nicht in höhr Haus wohnen. und die Miete bie 300€ Bitte Mit schone Grus  1.3.11.	3
In Korea wird der Wohnungsmarkt immer noch schlimmer. Früher war eine Wohnung ein Symbol für das Vermögen, oder eine Art und Weise, das Vermögen erhöhen zu können. Der Vorgang ist so. Man kauft eine große Wohnung, dann nach der Erhöhung des Preises der Wohnung verkäuft man sie. Aber leider geht das nicht mehr, weil alle Leute in Korea schon erkannt haben, dass der Preis der Wohnung Schaum ist. Wir brauchen, es so zu denke, dass die Wohnung nicht mehr eine Weise zum Vermögen ist, sondern ein Mittel zum Leben ist. Diese Veränderung des Erkenntnisse über Wohnung ist jetzt in Korea sehr wichtig. Sonst man kann ihr Geld, dass er in seinem ganzen Leben einspart hat, auf einmal verlieren. Noch eine Empfehlung zum Wohnungskauf ist, falls Sie ein Haus, zum Unternehmen kaufen möchten, dass Sie ein Haus kaufen müssen, in dem einige Wohnungen drin stehen. Sehr an der wie Früher ist eine kleine Wohnung in Korea sehr beliebt. Weil die Mitglieder in einer Familie wegen des Grundes der Arbeit oder des Studiums schon voneinander getrennt sind. Es gibt viele Leute in Korea, die allein oder nur zu zweit leben. Sie brauchen keine große Wohnung, sonder eine Kleine. Für solche Leute können Sie die Wohnung vermieten, und vermutlich Geld bekommen. Aber wenn es im Haus nur eine Wohnung gibt, können Sie weniger Geld erhalten. Eine Wohnung mieten ist nicht so schwer in Korea. Grundsätzlich kann das Geld und die Lage der Wohnung usw. Probleme sein. Aber das ist immer gleich Situation überall in der ganzen Welt, die wir haben, wenn wir eine Wohnung suchen.	0
Lieber Jens, Ich Glückwünsche dich ist Vater geworden. Wie es deine Frau und deine Babys? Wie heißt des Babys? Brauchst du etwas hilfe? Könntest du bitte mich anrufen? Herzlichen Grüßen Maria Meier	4
Aufsatz Deutschlernen es macht ein Vollsinn. Seit fünf Monate lerne ich Deutsch, und ich möchte im Herbst prüfung machen. Ich bin Definitiv für eine Schriftliche Sprachtest, weil man muss die Sprache, Kultur, Religion und Art des lebens des Landes kennen. Vor allem Dinge für mich ist wichtig die Begeisterung des Landes der Umgang mit Menchen, man lern die Sprache und fühlt sich wie in eigenen Heimat. Aßurserdem die Vorauszetzungen im einem fremden Land sind wichtig. Deswegen für mich hat ein Große Bedeutung. Dafür werde bis Ende kämpfen. Für mich Z.B. vor paar Jahren war es Unmöglich die Sprach zulernen, weil die Voraussetzungen waren anders. Man musste die Kurse selber bezahlen. Aber Heutzutage ich kann nicht nachvollzihen die manche Ausländer die nicht Wert auf die Sprache legen. Seit paar Jahren haben die Möglichkeit durch viele Institutionen in Deutschland die Sprache zulernen. Es gibt vielen Finanzile wege wie Z.B. Bamf. Europa, Socialfonds und viel mehr. Man sollte etwas für sich selber tun, vor allem muss Intrergriert sein. Dafür braucht man Motivation, sich selbst zu motivieren, dass heiß viel auch für die Zele. Ich bin zurzeit in ein Qualifikation und ich bin bereit weiter die Sprache zu lernen.	0
                                           Stadt X, 05.01.2012 Liebe Julia, ich habe eine Fahrkarte für eine woche Urlaub nach Paris. Die Fahrt beginnt am samstag  um 18.00 Uhr. Aber ich kann leider nicht fahren. Ich muss mit meiner Mama nach London in Urlaub. Liebe Jalia, ich möchte dich fragen ob du die Fahrkarte haben willst. Wenn Ja, kannst du mir telefonisch bescheid sagen. Besten Gruss M. Meier	3
mein Freund gestern hat kegommt ein Baby sein Baby ist schön und ich Freue euch und Ich wünsche dir von sein Baby geboren Baby heißt Maria Hezlichen Glück wünsch von Baby. Höffntlich Hochzeit Tag. Mit Freundlich Grüßen Tobias	4
Hallo Liebe Daniela, ich möchte am Samstag um 15.00 Uhr im Schwimmbad gehen. In Stadt X ist ein neue Schwimmbad und ich möchte da gehen. _Diese Schwimmbad ist so groß und sehr schön. Möchtest du mit mir gehen? Weiß du dass ich liebe schwimmen, aber zusammen ist besser. Nimm bitte ein Tüch, speciall Schuhe, ein Schampoo und etwas zu trinken. Ruft mir an oder schreibt wenn möchtest du gehen mit mir. Mit freundlichen Grüße Julia	4
Im Vergleich zu den oben genannten Sprachen Klingt Deutsche auf Anhieb härter und schwieriger. Sobald man sich mit ihm beschäftigt kann man daraufhin feststellen, dass es viele Regeln gibt, die man nur auswendig gut lernen kann, Trotz dieser Nachteilen finde ich es sehr vorteilhaft das Deutschlernen. Sobald man sich an der Aussprachen und an einer sehr strukturierten Grammatik gewöhnt hat, bekommt man auch dabei den Vorsprung, eine neue und gewissenhafte Einstellung anzunehmen. Man kann die Welt mit einem neuen Blick betrachten, indem man, wie bei der deutschen Sprache, sich an grundlegenden Regeln hältet. Im Deutschen lernt man zum Beispiel immer alle Wörter ganz deutlich auszusprechen. Sollte diese Gewohnheit auch bei anderen Sprache in Kraft treten, könnte man sicherlich behaupten eine bestimmte Fremdsprache auf der ganzen Welt zu beherrschen. Was die Position des Verbs betrifft ist seine Stelle am Ende eines Relativsatzes ganz wichtig, um die Aufmerksamkeit des Mitsprechers bis zum Ende des Dialogs auf einem höhen Niveau zu halten. Söllten mehrere Personen mit dieser deutlich strukturierten Sprache eine Annährungsversuch machen, hätte man die Möglichkeit viele Unverständnisse beim Reden, Lesen oder Schreiben zu verschwenden. Wenn es so wäre, könnte dann die Phantasie und Freiheit in anderen nützlicheren Bereichen Verwendung treffen.	0
Wohnungsmarkt in mein Stadt. Ich wohn in eine kleine Stadt heißt Stadt X. Nicht so viele Leute wohnen in diese Stadt. In meine Stadt gibt es keine Wohnungen. Viele Leute haben einige Häuser. Nicht große Häuser, dass bedeutet FamielenHäuser. Für die Leute haben kein privat Häuser sollen ein Zimmer mieten. Leben in ein paar Familien ist sehr gut, aber es gibt viele Famielien arm sind. So leben ist unterschiedlich zwischen familien. Wenn man ein Zimmer mieten mochte, soll man mit die Familie sprechen. Normalweise ist sehr schwer ein Zimmer zu finden. Es ist nich möglich ein Haus zu kaufen. Wenn man ein Haus verkauft sehr teuer ist. Mehr Leute kannen nicht ein Haus kaufen weil sehr teuer sind und nicht moglisch zu finden. Leben in mein Stadt ist ein normal leben. Es gibt reich Leute aber Sie Sind nicht viele. Mehr Leute haben nur genug zu leben. Lebenstand ist nicht höher.  Häuer sind für ein Familie in die Stadt, die Eltern und die Kinder. In die Stadt gibt keine Garten. Weil für ein Garten zu haben man muss ein große Landteil kaufen. Die normal Leute haben nicht mehr als drei Schlafzimmer. Nur wenig reich Leute haben große Häuser. Keine sehr höch Gebeude wie in andere Stadten. Die Stadt ist nicht in ein sehr  Ordnung. Die Leute bauen Häuser ohne Plan. Manchmal ist sehr schwer zu fahren um ein Straß nach anderen Straß. Es gibt auch sehr alt Häuser und sind gefahrlische für die Leute wohnen in dieser Häuser.	0
Sehr geehrte Frau Silke                          Stadt X(27/02/2012) Ich bedanke bei Ihnen Für den Brief. Ich habe an Ihren Gedanke gedacht und ich finde es schön. vielleicht komme ich für ein Paar Tage zu Ihnen zu besuchen, Für mich mag ich die Tiere nich. ich habe probleme mit sie besonders die Katzen. auf Jedenfall danke ich Ihnen Für Ihren vorschlag. Ich wünsche mir viele im meinem lebem: aber für meinen Geburtstag nichts viel. Für mich reicht aus wenn ich viele Erinnerungen indiesem besondern Tag habe Die mit Freunden und Familie sind. Ich habe kein interesse an Geschenken und sowas. deswegen sollen sie kein interesse  am Geschenkt Für mich Also. Mit und meiner familie geht es gut außer Meinem Vater hat ein Problem mit der Gesundheit aber sie wissen wie immer. Es ist vorbei Er ist zurzeit wieder Gesund und  passen sie auf Ihre Familie auf Mit Freundlichen Grüßen Michael	2
Hallo Dolly!! Wie geth es dir. Hallo Tom ich bin gut.  Möchtest du mit mir ins Kino Gehen? Es tut mir leid, ich habe keine Zeit, aber morgen am wie gehen ins Kino Ich möchte mit meine freunden morgen in der scwimen gehen, aber du hast Zeit von morgen um sieben Uhr zusammen gehen ins Schwimmen? Ja ich denke ja, Morgen wie fahren zu Schwimmen um zwanzig minuten nach sieben. OK. Tscüss!! 	4
Stefan Schmidt Müllergasse 12 1234 Stadt X Au-pair-Agentur Schultz & Partner Regenstr. 101 90451 Nürnberg                                          Stadt X, den 18. August 2011 Forderung einer Entschädigung Sehr geehrte Damen und Herren, als ich Ihre Anzeige gelesen habe, war ich sofort begeistert. da ich schon immer an einer Erfahrung als Au-pair teilnehmen wollte. Deshalb habe ich mich sofort bei Ihrer Au-pair Agentur angemeldet. Aber was Sie in Ihrer Anzeige versprochen haben, entsprach leider nicht der Realität. Erstens war ich sehr enttäuscht, dass es währen einer Woche in meiner Gastfamilie keine Kinder gab, weil Sie mit Ihrem Vater in Urlaub waren. Weiterhin war ich verärgert, weil ich jeden Tag selbst kochen musste. Aus diesem Grund habe ich keine Zeit um mich zu erholen. Obwohl in Ihrer Anzeige stand, dass Sie einen super-guten Service haben, finde ich diesen Service sehr schlecht, da ich dreimal an Ihrer Agentur geruft habe und niemand war da. Aus den oben genannten Gründen möchte ich Sie bitte, mir eine Entschädigung von mindestens 100 € zukommen zu lasen, weil ich diese Situation nicht akzeptieren kann. Ich wäre Ihnen sehr dankbar, wenn Sie mir bald antworten würden. Mit freundlichen Grüßen Stefan Schmidt	1
Eva Winkelmann                       Stadt X, 5.03.10. Bahnhofsstraße 1a 12345 Stadt X Computer-Spezialist Obenwaldstraße 5, 53119 Bonn Bewerbung um Praktikantenstelle als Sistemkauffrau Sehr geehrte Damen und Herren, mit Interesse habe ich Ihre Anzeige im Internet gelesen und bewerbe mich um ausgeschriebene Stelle der IT-Systemkauffrau in Ihren Unternehmen. Ich bin ausgebildete Systemkauffrau und war zunächst in meinem Ausbildungsbetrieb als Assistentin im neueröffnete Firma angestellt. Meine Arbeitweise und Aufmerksamkeit aus Ich bin kommunikationstarker und Flexible Mensch, Loyalität, Diskretion kennzeichen. Über eine Einladung zum persönliche Gespräch freu mich ganz besonderes Mit freundlichen Grüßen  Eva Winkelmann	1
                                            Stadt X, 04.01.2012 Sehr geehrte Damen und Herren, ich suche eine Wohnung Große. die Wohnung soll vier Zimmer haben mit drei schlafzimmer, Wohnzimmer, Küche, Badezimmer mit Dusche, Toilette und Balkon. Mit freundlichen Grüßen Eva Müller	3
Maria Meier Müllergasse 12 12345 Stadt X International Au-pair Bahnhofstr. 101 65185 Wiesbaden                                       Stadt X, den 10.10.11 Sehr geehrte Damen und Herren, ich habe Ihre Anzeige gelesen und ich interessire mich für eine Au-pair-Stelle in Deutschland. Ich möchte in Deutschland wie Au-pair erste mal sechs Monate bleiben. Wenn finde ich eine besser Deushe Familie danach ich habe eine große schance für Deutsche sprache lernenen. Ich kann ein bischje Deutsch spreche aber nicht zu viel. Deutsche sprache für mich wichtigste ist. Ich interesiere mich was muss in die Familie mache. Ich muss für die Kindern kümmer oder muss ich in die Küche etwas mache. Ich finde für mich sind alle leicht sind. Könen Sie mir bitte zeigen was kann ich in der Freizeitaktivitäten mache. Ich warte Ihrer Antworten. Mit freundlichen Grüßen Maria Meier	1
"Maria Müller Müllergasse 12 12-321 Stadt X Computer-Spezialist Odenwaldstraße 5 53119 Bonn                                                                                                    07.07.2010 Bewerbung um ein Praktikum Sehr geehrte Damen und Herren, ich studiere im 9. Semester Marketing und Management an der Wirtschaftsuniversität in Stadt X. Um mein Studium zu beenden, muss ich ein Praktikum im Ausland machen. Ihre Anzeige habe ich in der Jugendzeitschrift ""Student""gefunden. Ich habe Erfahrung im Verkauf und interessiere mich für elektronische Datenverarbeitung, darum habe ich beschlossen, mich um ein Praktikum bei Ihrer Firma zu bewerben. Im letzten Jahr habe ich in kleiner polnischen Firma gearbeitet,  wo ich für Verkauf und Marketing verantwortlich war. Jetzt möchte ich mein Praktikum in der großen ausländischen Firma machen. Ich spreche Deutsch und Englisch und möchte meine Sprachkenntnisse ausnutzen und vertiefen. Ich bin sehr offen, arbeitsam und verantwortlich. Ich mag mit den Leuten arbeiten und habe gut Kontakt mit den Kunden. Von diesem Praktikum erwarte ich, dass ich Erfahrung sammle, meine Kompetenz verbessere und meine Sprachkenntnisse vertiefe. Ich könnte die ganze Sommerferien arbeiten und ab 10. Juli könnte ich zu Ihrer Verfügung stehen. Über Ihrer positive Antwort würde ich mich sehr freuen. Mit freundlichen Grüßen  Maria Müller Anlage: -Lebenslauf -Zeugnisse"	1
Liebe Maria, meine Firma schickt mich für ein paar Tage nach Stadt X für ein Lehrgang Weiß ich nicht was ich mit meinem Hund machen soll. Ich habe an dich gedacht ob du meinen Hund betreuen kannst. Er ist brav und ich denke dass dir keine Probleme macht Konntest du den nach Hause für diesen paar Tage nehmen? Liebe Grüße.	3
"Was für Ausländer wichtig ist? ""Eigene tradition"" oder ""Kultur des Ausland""? Wie kann mann beantworten? wozu brauchen wir ""Kultur"" und ""tradition""? Naturlich, brauchen wir für beßeres Leben! Also, Jede Person hat eigene Idee und eigene Kultur. Das gehört unsere Karachter und unsere Personlichkeit. An diese Ansicht, muss man eigene Kultur behalten. Aber jedes Land hat eigene Geselschaft, eigene wetter, eigene Tradition, eigene Sprache, eigene Geschichte, und eigene Politik. Man muss sich orientieren Am wichtigsten ist das Sprache des Gastlandes lernnen. Damit kann man effeketive und erfolgreiche Kontakt haben. Außerdem, kann man nicht ohne gute Sprache,  von neue Kultur und lebensmoglichkeiten, genießen. Leben läuft weiter.  Man muss in neue leben sich entwickeln. Neue Leben hat neue weg! Daswegen, ist es sinnvoll, im Ausland die Traditionen seines Heimatlandes fortsetzen. Man muss sich an der Kultur des Gaslandes orientieren."	0
Lieber Ingo, wie geht es Dir? mir geht es gut. Ich habe eine Arbeit in Neuburg gefunden. Ich brauche eine Wohnung in Neuburg. Ich möchte Dir helfen. Kannst du eine Wohnung im Internet suchen? Die Wohnung hat 3 Zimmer, 1 Küchezimmer, 1 Badzimmer und 1 Schlafzimmer. Die Wohnung ist klein, 45 m² und sie ist Neubauwohnung. Kann du mir information, Pries schicken? Ich möchte zum 1. Mai einziehen. Antworte bitte bald. Liebe Grüße Deine Freundin Maria Müller	4
Julia Schmidt Bahnhofstr. 123 12345 Stadt X Computer-Spezialist Odenwaldstraße 5 53119 Bonn                               08.02.2009 Bewerbung um einen Praktikumsplatz Sehr geehrte Damen und Herren, Ich interessiere mich dafür, mein Praktikum bei Ihrem Geschäft zu machen. Für diese Stelle bringe ich alle Voraussetzungen mit. Ich habe 4 Jahre Wirtschaft an der Uni in der Ukraine studiert. Meine Spezialisierung ist Betriebswirtschaft. Ich spreche gut Russisch, Deutsch, Englisch und ich habe Grundkenntnisse in Franzosisch. Ich habe auch gute Computerkenntnisse. Ich habe gern mit anderen Leuten zu tun und ich arbeite gern im Team. Ich möchte in Deutschland arbeiten, weil ich glaube, dass ich auf diese Weise die Gelegenheit haben werde, nicht nur die Arbeit, sondern auch die Mentalität der Deutschen besser kennen zu lernen. Diese Erfahrung wird mir später bei meiner Arbeit in der Ukraine helfen und in der deutscher Sprache Vielen Dank am hinaus Mit freundlichen Grüßen Julia Schmidt	1
Liber Ingo                                            16.3.2012 Wie geht´s dir, mir geht gut und meine famile auch.aber Ich haber eine Arbeit in Neuburg Mier brauch eine Wohnung. Der Wohnung findet ich mit 75 m². Größe Bitte hilfstu mir suhen eine Wohnung Libern Julia Winkelmann	4
Katharina Müller Bahnhofsstraße 37 12345 Stadt X   Internationale Au-pair Bahnhofstr. 101 65185 Wiesbaden                                                                 Stadt X, den 14.08.2010 Sehr geehrte Damen und Herren, mit grossem Interesse habe ich Ihre Anzeige in der Zeitung gelesen. Ich bin daran interessiert, und wurde gerne mehr Information zu bekommen. Zum Beispiel. Ich mochte gerne wissen, ob dass man Deutsch sprechen muss um sich bewerben. Welches Aufenthatsformalitäten man sollte erledigen? Gibt es Rechte und Pflichten, dass man kennen mussen? Ausserdem ich wurde auch noch wissen, wie es geht mit den Feizeitaktivitäten. Bezahlen Sie Monatslohn und wenn ja, wie viel. Ich habe keine erfahrung und ich habe 17 Jahre Alt. Ist das eigentlich einen Nachteil? Ich bin Studentin und habe weder telephon, noch kein Geld, deswegen rufe Ihnen nicht. Aber ich wurde Ihnen danken um mir diesen Informationen per Post schicken. mit freundlichen Grüsse Katharina Müller	1
                                         Stadt X denn 27.02.2012   Liebe Silke, Vielen Dank für dein nettes Brief, hat mir sehr gefreut. Uns es geht in moment gut, Maria ist in der Schule, und in 2 Wochen fliegt mit ihre Klasse nach Stadt Y - Frankreich, sie kommt in eine Familie an, und sie wird dort auch eine Schule besuchen, ich denke das für sie eine schöne erlebnis wird. Mir geht es wie immer: Arbeit, das Haus und in der letzte Zeit mache ich 3 mal pro Woche Sport. Ich finde Super eure Geschenk an Max, eine Kätze; Maria und ich lieben Kätze, leider sind wir fast den ganzen Tag unter wegs , und ich habe immer gedacht dass ein Tier braucht vor allen aufmerksamkeit. Wegen ein Geschenk zum meinen Geburtstag, bitte macht ihr keine Sorge, ich freue mich euch wieder zu sehen könne, ich überlege noch genau wann, ich hoffe dass uns beide wären der Sommerferien passend kann. In der nächsten Tage werde ich mich bei euch melden, dann können wir unsere Besuch vereinbaren. Schöne Grüße an alle von uns und bis dahin, Deine Katharina	2
