text	readability
Patriotismus ist ein sehr starkes Gefühl dass alle Menschen sicherlich kennen. In diesem Artikel geht es um folgendes Problem ob im Ausland die Traditionen seines Heimatland fortzusetzen, oder im Gengensatz neue Traditionen kennenlerne. Ich würde sagen dass disen Thema sehr interessant ist und sehr wichtig. Einerseits bin ich der Meinung dass im Ausland man sich an der Kultur des Gastlandes orientieren soll, weil es viel höfflicher wäre. Sonst könnten Sie sich vorstellen im Ausland zu wohnen und die Traditionen nicht respektieren? Es bedeutet nicht nur das Essen, die Feiertage, usw... sondern auch die Sprache. Tatsächlich die Sprache gehört ohne Zweifel zu die Traditionen von ein land. Also, jetzt möchte ich hinzufügen, dass wenn man im Ausland wohnt es ist logisch dass er die Kultur, die Traditionen und die Sprache kennenlernen wird. Um meine Meinung zu ercklären möchte ich ein Beispiel anführen: Um eine Arbeitsstelle zu bekommen, man muss die Traditionen kennen und respektieren außerdem ist es besser wenn man gut in dem Land intergriert ist. Je man besser integriert ist, desto mehr Erfolg man hat. Andererseits kann ich verstehen dass manche Leuten ihren eigenen Traditionen bevorzugen. Vielleicht auch wenn man seine Traditionen macht, bekommt man Heimweh und Sehnsucht. Persönlich weiß ich dass wenn ich nicht mehr Französische Ernährung esse vermisse ich sofort Frankreich. Man kann auch seine Nationalität vergessen und dazu seine eigene Identität. Zum Beispiel gibt es solche Traditionen die können nicht verändert sein wie Religion. Allerdings ist es ein wichtige Punkt in die Traditionen von ein Land. Zum Abschluss würde ich sagen dass es wichtig ist dass man nicht seine Traditionen vergisst. Jedoch die Auswändern sollen auch sich integrieren und sich interessieren für die Traditionen des Gastland und natürlich auch versuchen. Was wäre auch toll, dass die Auswändern und die Leuten die in Gastland wohnen ein Einladung zusammen machen und einfach die Traditionnen tauschen.	0
Friedrich Winkelmann                             den 10 April 2012 Zentralplatz 10 Stadt X Sehr geehrte Damen und Herrn Ich suche einen Wohnung in der Nähe Stadt Y. Ich würde gern einen Wohnung mit 3 Zimmer Küche und Bad Suchen. Ich auch interessiere mich ein Wohnung mit Balkon habe. Ich habe ein Auto. Ich möchte ein Wohnung mit ein Garage Suchen. Ich möchte eine Wohnung auf dem Land Suchen, Weil ich ruhig und Natur liebe. Ich möchte auch Wissen, Wie hoch ist die Miete für die Wohnung auf dem Land pro monat. Ich hoffe auf eine baldige Antwort Mit freundlichen Grüßen Friedrich Winkelmann	3
Hallo ingo, Ich habe eine Arbeit in Neuburg gefunden und ich möchte eine neue Wohnung in Neuburg am Erste Jule. ich müss ziew Zimmer Wohnungssuche. Kannst du bitt hilfen. Viele Grüße Eva	4
"""Das Leben hat wie eine Münze zwei Seiten"" Das dieses Sprichwort viel Wahrheit enthält, weis ich aus eigner Erfahrung, den ich bin ein zwei Kulturen beziehungweise Traditionen aufgewachen: In der kurdischen und in der arbischen. Das ist im Altag nicht immer deutlich zu spüren, den viele Rituale und Traditionen sind ähnlich zum beispiel (Beschneidung und Muttertag). Aber andere Dinge sind sehr unterschiedlich. Einzigartiger kurdische Tradition ist das (Nawerosfest). Die Tradition des Nawio Festes geht bis in Jahr 612 V. chr (vor christos) zurück. Am Vorabend zünden die Menschen Kerze an. Das Signalfeuer damals am Tag der Befreiung erinnern. Am Festtag selbst treffen sich die Leute in der Natur, um gemeinsam zu essen, zu trinken, zu tansen und mit der sehr gute Laune zu feiern. Eine weitere Beispiel für die Ähnlichkeit des Kulteren und Traditionen ist das Opfer Fest. Das in großteil der Kurden und arabischen Bevolkerung Muslime sind. Als wir nach Deutschland kamen, stellten wir fest, dass dieser Fest nur dort bekannt ist wo viele Kurden leben. Als Frühlingsfest könnten es aber sowohl Kurden als auch die Deutschen gemeinsam feiren. Kurdische Kultur Vereine organisieren jedes Jahr Veranstaltungen zum Nawros Fest . Das wäre ein guter Anlaß, um sich gegenseitig besser kennen zu lernen. Obwohl man in Deutschland als auslandische Mitburger lebt, soll man denoch seine Kultur bzw Tradition auf Recht er hält und gepflegt."	0
Viele Artikel kann man über die Integration in der Zeitung lesen, aber hier kann diese Thema aus einem anderen Aspekt beleuchtet werden. Ich helfe Ihnen eine Entscheidung treffen, ob Sie integrieren sollten oder Ihre Traditionen weiterbringen sollten. Erstesmal: muss die Jahrgruppe geschätzt werden. Gemäß den ältere Generation können die Jungen sich in Ausland besser integrieren lassen. Weitergehend muss unsere Pläne überlegen. Je mehr Zeit möchten verbringen werden desto nötiger ist die Integration.  Die erste Schritte von Integration ist die Sprachbenutzungsfähigkeit, die man von allen Auswanderer/Einwanderer erwarten kann. Darüber hinaus darf man seine Heimkultur üben, aber das ist besser, wenn man das in seinem Haus macht und äußert es nicht nach anderen Bürgern. Trotz diese Möglichkeit kann die Erkennung von anderen Kulturen sich lohnen. In der beigefügten Tabelle neben dem Artikel können Sie darüber weitere Informationen bekommen. Dieser Orientierung nach den ausländischen Kulturellen gibt es verschiedene Stufe. Erstesmal muss man die Gesichte und die Religion vom Ausland erkennen, danach die Wirtschaft und die heutige Regierung kommen wird. In diesen Reihenfolge kann man am besten verstehen, wie die Bürger sich verhalten und was man danach findet. Wenn man die nächste Stufe erreicht, dann kann man zwischen einzigen Personen vom Land Unterschied ziehen. Damit könnte man sich Lohnen. Diesen Kentnisse kann man in Alltag und in Arbeitsleben auch ausnutzen. Ich würde für jede Leser empfehlen neue Kulturen kennenzulernen. Damit kann man später seine eigene Kultur besser ereignen.	0
Lieber Daniela Heute ab ich frei, willst du mit mir ins schwimbad gehen. Wir konnen heute mittag in Stadt X treffen um 15:00 Uhr. Bringst du bitte eine Ankusch? ODER AnVusch? und Kleine Geld fur die Seife. Viel Grußen Michael	4
Lieber Ingo, wie geht es Dir? Ich brauche eine Wohnung in Neuburg. Kannst du mir helfen? Ich suche zum 20. April. Die Wohnung ist zweiter Stock, mit Balkon und mit Garage. Kannst du Wohnungsanzeigen suchen? Ich warte Dich. Bitte ruf mich an. Viele Grüße Maria	4
Wohnungsmarkt in Stadt X Es ist immer eine wichtige Entscheidung, um ins Ausland zu gehen. Deren Folgen dauernhafte Wirkung auf unserem Leben haben. Dabei tauchen immer einige Fragen auf, wie kann man sich auf der neuuen Umstände anpassen und worauf muss man denken. Eine wichtige Thema ist die Wohnung. Es ist überhaupt wichtig, dass eine Wohnung oder ein Haus unsere Erwartungen erfühlen kann. Denn es ist sehr teuer und kompliziert nochmal umziehen. Deshalb muss man zu erst seine Erwartungen gut definieren, bevor er fang mit der Wohnungssuche an. Zu zweit ist es wichtig den lokale Markt zu kennen. In Stadt X gibt es viele Wohnungen zu vermieten, aber man muss auf ein paar Dinge aufpassen. Die Wohnungen sind sehr oft an der Studenten vermitet, und deshalb steigen die Preise während des Herbs. Falls es möglich ist, ist es besser eine Wohnung während des Winters zu vermieten. Ein weiteres Problem ist die Ausrustung der Wohnung.  In Kroatien sind die Wohnungen ohne Möbel vermietet, und man muss seine eigene Möbel bringen. Das nächste Punkt ist die Lokation der Wohnung. Kroatische Küste ist sehr berühmt und schön, deshalb sind die Wohnungen an der Küste viel teuere als die gleiche Wohnungen im Ort, der nicht direkt an der Küste ist. Natürlich ist es viel schöner ein Wohnung  mit einem Blick auf dem Meer zu haben, aber je schöner der Ort ist, desto teuere ist die Wohnung. Abschliesslich können wir sagen, dass es noch gute und günstige Wohnungen gibt, aber abhängig vom Ort und Zeit.	0
Liebe Ingo,                                          06.03.2012 wie gehts ist dir? Ich habe eine Arbeit in Neuburg und brauche ich Neue wohnung bei nächste woche 20.03.2012. Kanns du mir helfen? Ich brauche nur ein Schlafzimmer und ein Kinder Zimmer. Viele Grüße Katharina	4
                                            Stadt X 13.3.2012 Lieber Michael, vielen Dank für deine Antwort. Die Silvesternacht habe ich mit meinem Mann und unseren Freunde verbracht. Diese Nacht war super. Wir haben in einen Restaurant gegangen, etwas gegessen und später haben wir in einen Disco gegangen. Vor diesem Disco war ein Feuerwerk. Meine Wunsch für neue Jahr ist eines neues Job gefunden, weil auf meine Arbeit viel stresig ist, wie immer, und mein Chef ist immer schlecht gelaunt und böse. Gester habe ich in eine gute Firma bewerbung geschickt und jetzt warte ich auf die Antwort. Wir haben uns lang nicht gesehen. Hast du Lust nächste Woche mit Julia bei uns kommen? Wir machen Party zu Hause für alle Freunde. Wir freuen uns auf euch. Herzliche Grüße Julia	2
                                                                Stadt X, 08.03.2012 Lieber Michael, vielen dank für deine Brief und deine Glückwunsch zum neuen Jahr. Die Silvesternacht haben wir bei meinen Eltern verbracht. Meine Schwester mit ihre Familie auch war da. Wir haben viele gespielt, gegessen und lachen. Später sind wir dann in den unseren Garden gegangen, wo wir uns das Feuerwerk angesehen haben. Es war echt super! Ich wünsche für neuen Jahren meine Deutschkurs fertig. Bei meinen Arbeit gibt ein neue Kolegin. Sie ist sehr lustig. Ich freue mich übern euren besuchen. Viele Grüße Katharina	2
Eva Müller Winkelmann                       Stadt X, den 13.10.2011 Bahnhofsstraße 11 12345 Stadt X Au-pair Agentur Schultz & Partner Regenstr. 101 90451 Nürnberg Beschwerde wegen nicht erbrachter Leistung Sehr geehrte Damen und Herren, ich habe vor Kurzem bei einer Gastfamilie in Deutschland verbracht. Als ich Ihre Werbeanzeige gelesen habe, war ich sofort begeistert. Ich wollte immer als Au-pair nach Deutschland gehen. Leider muss ich Ihnen mitteilen, dass meine Erwartungen in keiner Weise erfüllt wurden. Sie haben in Ihrer Anzeige sehr viel versprochen. Meine Gastfamilie hatte keine Erfahrungen mit Ausländern gehabt und nicht, wie Sie angegeben haben langjährige Erfahrung. Die Gastfamilie könnte überhaupt kein Deutsch sprechen, da ich nur Englisch gesprochen habe. Die Kindern waren nicht in Deutschland, deswegen sollte ich auf die Eltern aufpassen, die funfzig Jahre alt sind. Außerdem gab es keine gute Service, da ich fast ein mal in der Woche bei Ihnen angerufen haben und keine dran gegagen ist. Alles in allem war dieses Vierteljahr eine einzige Katastrophe und ich bin sehr unzufrieden. Aus diesem Grund bitte ich Sie, mir eine angemessene Summe des Preises zurückzuerstatten. Ich würde mich über eine baldige und schriftliche Antwort sehr freuen. Ich bedanke mich im Voraus. Mit freundlichen Grüßen. Eva Müller	1
Liebe Jens! Wie geht es die? Ich Glückwünsche mi meine Mann, bist du Vater :) Ich Vroümlich :) Wie ist Vorname die kleine Babys? Ist das Menchen oder Jung? Wie es deine Frau und die Mutter des Babys geht? Das ist schne information wirdklich! Antworten Sie Bitte und Noch mall Froümlich. Viel Glück :) Tschus! 	4
Sehr geehrter Herr Müller, Ich suche ein Wohnug mit Balkon und Garage, 3 zimmer + Küche Die miete muß bis 350 E sein, Bitte senden Sie mir per Post oder faxen der angobot. Mit freundlichen Grüßen ++	3
Für Leute auf der Welt ist es schon eindeutig, dass Englisch, Französisch und Spanisch am meisten gesprochen werden. Deswegen möchten Menschen diese Sprachen lernen. An meiner Stelle, dass ich jetzt Deutsch lerne, sehe ich die Tatsache als Unsinn. Das hießt, ich fühle mich wohl, dass ich die deutsche Sprache kann, die normalerweise als eine nicht nützliche Sprache angesehen wird. Weil ich in Deutschland studieren will, ist es notwendig, diese Sprache zu erlernen. Meinem eigenen Zustand zufolge ist Deutsch eine wichtigste Sprache sogar als meine Muttersprache. Meiner Meinung nach sollte man sich selbst entscheiden, welche Sprache am nützlichsten ist. Die Tatsache, dass die drei erwähnten Sprachen beliebt sind, muss man natürlich akzeptieren. Aber das sollte kein Grund dafür sein, dass die Sprache, die von einem gesprochen oder gelernt wird, sinnlos zu verwenden ist. Ich werde von meinen Bekannten danach gefragt, warum ich eigentlich in Deutschland studieren möchte, damit ich ich ohne Ausnahme die in diesem Land gesprochene Sprache lernen muss. Manche Leute, die sich wie ich dazu entschlossen haben, Deutsch zu lernen, werden frustriert, wenn sie gefragt werden, weil sie auch wissen, dass die deutsche Sprache nicht so beliebt auf der Erde ist. Aber ich bin immer selbstbewusst. Wegen meines Traums, dass ich in Deutschland das Studium erfolgreich abschliesse, ist Deutsch meine beliebteste Fremdsprache. Und ich würde auch empfehlen, viele Sprache ohne dieser Vorurteil zu lernen.	0
Au-pairs Global Bahnhofstraße 101 65185 Wiesbaden Deutschland                                                                                    Stadt X 28.10.2011 Betreff: Au-pair Stelle in Deutschland Sehr geehrte Damen und Herren, ich habe ihre Anzeige über Internationale Au-pair Vermittlung gelesen und bin dafür interessiert.  Ich bin momentan auf der Suche eines Jobs in Deutschland um meine Sprachekompetenzen zu verbessern. Zur Zeit ist mein Deutsch nicht Perfekt.  Wäre es ein Problem, damit ich eine Stelle bekommen kann? Wäre es möglich manchmal Abends dort raus zu gehen oder muss ich unbedingt jeden Tag früh zu Hause sein? Darüber hinaus möchte ich wissen ob ich auch Lebensmittel bekommen würde oder müsste ich jedoch sie selbst kaufen. Mich interessiert besonders meine Freizeit dort. Sind die Familien nomaleweise flexibel damit oder es kommt darauf an welchen?  Haben Sie mittelweile feste Auswahlkriterium? Brauch man Erfahrung als Au-pair um mehr Möglichkeiten um gewäht zu werden, zu haben? Noch die letzte Frage möchte ich stellen: Kann man die Stadt Deutschlands wo man gerne gehen möchte wählen?  Ich freue mich sehr auf ihren Antwort. Mit freundlichen Grüßen.  Maria Meier  Bahnhofsstraße  50007 - Stadt X Spanien 	1
Lieber Jens, wie geht es Dir? Ich möchte Dir Herzliche Glückwünsche schicken. Du hast Vater geworden. Wie geht es der Mutter und wie geht es dem Baby? Ich wünsche Dir und deiner Familie Gesundheit, Glück und viel Spaß. Antworte mir bitte. Herzliche Grüße. Deine Freundin Maria Meier	4
Libe Silke!                      24.02.2002. Wie geht es dir? und deiner Familie? Uns geht auch ganz gut. Wie geht Katze von Max? Libt noch? Wir Treffen mit dir und deine Familie auf mein Geburtstag und schenken mir ein Hund. Kusen Sie viele mal! Tobias	2
Lieb Mari, Viele Grüße von Tobias! Wie geht´s dir? Es geht´s mir gut. Ich möchte am 25 märz nach Indien fliegen. Ich habe einen Hund, er heißt Waldi. Ich Kann nicht Waldi fliegen mit. Deshalb würde ich den Hund mit dir bleiben. Ich fliege am Ende März zuruck. Ich denke es Kein Problem für dir. Ich warte auf dein Antwort. Vielen Dank dein Tobias	3
Sr. Maria Katharina St. Eva Bahnhofsstraße 12 A 12345 Stadt X     Ihre Anziege wohnung miete Stadt Y                                                                                                 Stadt X den 10 märz 2010 Sehr geehrte Damen und Herren, Ich möchte eine wohnung miete. Ich möchte drei Zimmer, Küche und Balkon. Wie kostet eine Wohnung. Ich bin Krankenschwster von Beruf. Ich möchte dort mit meine familie einziehen. Ich möchte 250 € Miete geben. Wie hoch sind die umlage und Nebenkoste? Ab wann ist die wohnung frei Ich kann erst am 24 märz einziehen. Ich möchte besuchen die wohnung, wann haben sie Zeit? Gibt es die wohnung? wir hoffen auf eine baldige Antwort Mit Freundlichen Grüßen Sr. Maria	3
                                       Stadt X, 9. March Liebe Dana, Ich freue mich deinen Brief zu bekommen. Herzliche Glückwunsch zur Prüfung bestanden. Ich danke dir für die Einladung. Ich besuche dir gerne nach deinem Urlaub. Es war sehr schön, wenn ich dir letztemal besucht habe. Es ist gut zu hören dass, Die Stadt dir sehr gefahlt. Ich mag die traditionalle Kleidung aus Istanbul. Kannst du die mitbringen? Ja, Es ist immer schön, wenn man Verwandte im Ausland hat. Meine Verwandten sind auch im Ausland leben. Ich besuche ihnen in meinem Urlaub.  Viel Spaß und Bis bald  Eva	2
Frankfurt Rundschau                                      Stadt X, 10.03.12 Bahnhofsstr 123 Michael Müller Akademie Klausenhof Winkelsg. 321. Sehr geehrte Dammen und Herren. Wohnung Anziege. Ich suche ein neue 2Zimmer Wonung. Ich lebe jetzt in Stadt X aber möchte ich nachste Monat im Stadt Y zeihen. I suche ein Wohnung mit ein Balkon und Garage weil ich habe Kinder und liebe Spatz. Ich mochte ein Bisichtigungstermin vereiban mit euch. Ich warte Antwort bitte. Mit freundlichen Grußen Michael Müller	3
Maria Müller Bahnhofsstraße 123 12-321 Stadt X Computer-Spezialist Odenwaldstraße 5  53119 Bonn                                                                              Stadt X, 7.07.10 Bewerbungsbrief um ein Praktikum Sehr geehrte Damen und Herren, bezüglich Ihres Angebots möchte ich mich um ein Praktikum im Bereich Verkauf bewerben. Jetzt studiere ich IT-Systems an Wirtschaftshochschule in Stadt Y. Ich bin im 6. Semester und brauche ein Praktikum um einen Abschluss zu machen, deshalb möchte ich bei Ihre Firma arbeiten. Ich habe großes Interesse an elektronischer Datenverarbeitung und knüpfe auch sehr leicht die Kontakte an. ich bin offen und lerne schnell. Ich hoffe, dass meine fachliche Kompetenze genug sind. Ich erwarte eine zweimonatliche Praktikum im Verkaufabteil um meine Verkauf- und IT-Kentnisse zu verbessern. Seit 1. August konnte ich anfangen. Ich bin flexible, so dass verschieden Arbeitzeit möglich ist. Ich möchte 20 Euro pro Tag bekommen. Ich hoffe, dass meine Bewerbung Ihr Aufmerksamkeit erregen wird. Mit freundlichen Grüßen Maria Müller	1
LiBe jens bekomen eine Bebi Vil Glückwünsche Vie es der Mutter  Grüze Eva Meier	4
                                                   2012, den 27 Liebe Silke, Ich freue mich sehr über deinen Brief.  Uns geht es ganz Super danke, Maria geht Schon In der fünfte Klasse In die Stadt, Sie freut sich Sehr uber ihre neues Schule, Michael geht Schon In der neuenten Klasse und wir haben streichen immer über ihren zimmer, Laut musik und Freunden! Pübertät finde ich schlim. Mein Mann geht auch gut aber muss Jeder woche zwei stunden mit die Auto fahren zur Arbeit, dass finde er anstrengnd. Danke für dein einladung villeicht habe ich zeit zwischen den neunten und zwölften märz. Weil Ich eine frei tage vom Arbeit genommen hat , Ich rufe dir Später und erklären genau wann ich kommen kann. Ich mag Tiere auch sehr, wir haben ein Hund, eine Katze und ein Häse das gehort Maria aber es stört mich, Wenn zum beispiel die Katze macht Peepee ins Sofa oder mit Kleidung spielen, Trotzdem die Kinder mag alle und Kummer sich auch gut um Sie. Ich könnte nicht glauben, dass ich siebenunddreißig alt werden. Ich möchte gern etwas mit Mozart haben aber soll nicht teuer sein meine freundin. Ich warte auch für sie In meine Geburtstag Party. Viele Grüße zu deiner Familie. Bis bald, Katharina	2
Wohnungsmarkt in Stadt X Stadt X ist der größte Stadt in Deutschland und hat viele Wohnungsmöglickeiten. Die Mieten sind ziemlich teuer wie alle andere Hauptstadten. Je mehr man sich von dem Zentrum entfernt, Desto weniger soll man für Miete zahlen. Ausserdem hat Berlin eine super öffentliche Verkehrsmittel system. Sogar im Nacht hat man viele Verkehrsmöglichkeiten. Innerhalb des Stadts brauchtman kein Auto. Aber eine Auto wird ein Vorteil für die Leute die im ausserhalb des Stadt wohnen wollen. im Ausserhalb des Stadt gibts nicht nur schone Wohnungen sondern auch grosse Häuser für die Famillien. Dieser Teil ist natürlich grüner und ruhiger als Zentrum und sicher für die Famillien die Kinder haben. In Zentrum kann mann kleine wohnunger Mieten oder eine Wohnungsgemeinschaft austeilen. Vor man ein Haus oder Wohnung in Stadt X kaufen oder mieten, soll er erst die Distanz zwischen Haus und die Öffentlideverkehrsmittels beachten. In der nähe von einer U-bahn oder S-bahn wohnen ist ein Vorteil, weil Fahren kann auch viel kosten und es eine grösse Parkplatzproblemme wie in alle Metropolen auch in Berlin gibt. Man soll die Mieten gut rechancieren und am besten Rat von seinen Kollegen annehmen.	0
Sehr geehrte Damen und Herren, ich habe eine schöne Pflicht Sie über den Wohnungsmarkt in Stadt X informieren. Der Wohnungsmarkt in Stadt X ist sehr breit. Unsere Stadt hat 1,2 Milionen Einwohner und alle wollen natürlich schön wohnen. Ich fange zuerst mit dem Familienwohnen an. Jede Familie braucht genug Platz für alle famielien Mitglieger Die Familie kann entweder ein eigenes Haus bauen oder einen Wohnung kaufen oder mieten. Jetzt kommt aber die Frage, was besser wird? Für viele Famielien ist unmöglich etwas Eigenes bauen oder kaufen und dann wählen sie die zweite Möglichkeit. Etwas mieten. Beim Mieten ist gut, dass wir weniger Geld für die Miete ausgeben müssen. An der anderen Seite gehört der Wohnung nicht uns und wenn wir in den Wohnung Geld investieren geben wir nur Geld aus. In dieser Zeit kommen viele Angebote, wie man Geld ausleihen kann. Diese Möglichkeit würde ich nur in dem Fall wählen, wenn Geld bei der Bank ausgeliehen wird.  Wenn jemand alleine wohnt, braucht nichts großes. Bei den Einzelpersonen kann ich nur die Wohnungen empfehlen. Für kleineren Wohnung muss man weniger zahlen und trotzdem kann man ganz gut wohnen.  Ich hoffe, dass Sie jetzt bessere Vorstellung von Wohnen in Tschechien haben und ich freue mich auf unsere Mitarbeit. Mit freundlichen Grüßen Eva Müller Stadt Y, den 29.7.2011	0
Sehr geehrte Kollegen und Kolleginnen Ich möchte Ihnen gern den Wohnungsmarkt in meinem Stadt vorstellen. Stadt X ist mein HeimerOrt, der in Nordpolen liegt, und ca. viertausend Einwohner hat. Es ist ein kleines Ort mit ziemlich großem Wohnungsmarkt. Bevor man sich aber entscheidet dort zu wohnen, muss man ein bischen mehr davon erfahren. Dort gibt es viel Wäldern und Seen aber leider kein Theater und Kino. Wenn man Natur liebt ist das ein idealer Ort, weil es dort viel Rad und Wandernwege gibt. Der Wohnungsmarkt ist auch groß. Viele Bewohner sind in die groß Stätde umgezogen und haben ihre Hause frei stehen gelassen, die jetz zu vermitten sind. Es werden bis Ende 2012 auch zwei Siedlungen fertig gebaut. Wenn man ein Zimmer mieten möchte ist auch selbstverständlich möglich, weil die meisten Einwohner immer genug Platz in ihre Wohnungen haben, und möchten sie teilweise vermieten. Ein wichtiges Aspekt ist, dass sich meistens besser lohnt eine Wohnung zu kaufen statt zu mieten. Seit anfang 2011 sind die Kaufpresse deutlich gefallen. Bevor man sich aber entscheidet dort etwas zu kaufen oder zu Mieten, sollte man lieber paar Tage dort verbringen. Dann weiss man ob dass ein richtige Platz für ihm ist. Nach und Fernverkehr funktionieren gut. Vor Ort sind gute Einkaufsmöglichkeiten,sowol kleine Händler als auch zwei mittelgroße Einkaufszenter. Bei Kauf oder Mieten einer Wohnung es ist auf jeden fall sehr wichtig paar Angebote zu vergleichen, oder in die Umgebung zu suchen, weil dort die Preise noch niedriger sind.  Ich wünsche allem viel Spaß und Erfolg bei der Suche.	0
"Meinem Thema lautet ""Is es sinnvoll, auch im Ausland die seines Haimatlands fortzusetzen."" Ich finde, dass Thema sehr Interessant, weil es sehr wichtiges Punkt in Europa geworden ist. Einerseits macht es Sinn das Kultur zu fortzusetzen. Anderseits gibt es viele Probleme in Gastland, weil man nicht mehr in Gastland ohne neue Kultur zu lernen. In Gastland zwar verliert den selbern Kultur aber lernt man viel von den neuen Kultur. Ich vermute, dass es ist sinnvall, wenn man neue Kultur learnt, weil es sinn macht. Es ist auch Sehr wichtig, wenn man nue Sprache learnt, weil Sprach wie eine bruche ist. Sprache macht einfache in Gastland zu leben. Z.B. Lerent man Deutsch in Deutschland, weil es Landssprache ist. And die Sprache Integration ist. Ohne Sprache geht es gar nicht. Ich möchte heir sagen, dass es nicht einfach neue Kultur zu learn, trozdem ist sehr sinnvall Gastland Kultur zu nehmen. Wenn ich mit der Leute Deutsch sprache, finden sie es wie einen von denen. Ich finde, dass Gastland meine neue Heimatland ist. Es wäre sehr gut, wenn ich prefket Deutsch Sprache. Heimtland war meines Land und es beliebt. Aber ich sollte neue Learn und neue anfangen. Es bedeutet neue learn und ich sollte mich an der kultur der Gastland orientieren. Ich finde, dass es keine gefähr neue zu Orientiern. Aber ich muss auch meine Kultur behalten. Es ist eine Herausfordung. Abschließed möchte ich sagen: ""Wird es besser wird es schlimer fragt mann all Jahrlich seien wir ehrlich das Leben ist immer Lebensgefährlich"" Darum mussen wir Gastland kultur nehmen mit dem offenen Herzen. Denn hat man keine Fremdikeit im Gastland."	0
                                  Stadt X, den 09.03.2012 Liebe Dana, Hertzliche Glückwunch zur bestandenen Prüfung. Ich habe für lange Zeit eine Reise nach Türkei geplant. Jetz wann du in Istanbull sind, kann ich dich besuchen, aber zu erst muss ich mit meinen Verwandten sprechen. Sie leben auch in Instanbul. Als ich bald komme bei dir wünsche ich gar keine geschenk. Ich würde bis morgen einen neuen E-mail schreiben und sagen dir ob ich komme oder nicht. Heute würde ich dein Haus besuchen. Viele Grüße Katharina	2
